{
  "example_only": true,
  "parameters": {
    "order_id": {
      "quality": "KNOWN",
      "value": "O-100",
      "source_refs": [
        "Q_CONTEXT"
      ]
    },
    "met_driver": {
      "quality": "KNOWN",
      "value": false,
      "source_refs": [
        "event:SYNTHETIC-EVENT-1"
      ]
    },
    "other_information_complete": {
      "quality": "KNOWN",
      "value": true,
      "source_refs": [
        "Q_HISTORY:fixture"
      ]
    }
  },
  "as_of": "2026-10-01T00:00:10Z",
  "schema_version": "service-decision-dsl.parameter-snapshot.v2",
  "prepared_for": {
    "workflow_id": "demo.solve",
    "phase_id": "P3",
    "step_id": "P3.S1",
    "node_id": "D1"
  },
  "definition_digest": "1e65ec3becb62b4eca18a39bd67373a1c5b065452195cf649ed1633a93782730",
  "subject_scope_ref": "synthetic:tenant-demo:order-O-100",
  "provenance": {
    "environment": "SYNTHETIC",
    "fixture_only": true,
    "scope_note": "No authenticated source or production readiness claim",
    "event_ref": "SYNTHETIC-EVENT-1"
  }
}
